{
  "configuration": {"locales": ["en", "zh-Hans"], "mode": "readme", "project_type": "developer-tool", "scanner_profile": "balanced"},
  "created_at": "2026-08-02T00:00:00Z",
  "current_stage": "scan",
  "run_id": "88712b7258498d82f7562fbb680a6f7616b604cacdbbd60f3748cf6e823f536d",
  "schema_version": 1,
  "stages": [
    {"attempt": 0, "completed_at": null, "input_sha256": null, "name": "scan", "output_sha256": null, "started_at": null, "status": "pending"},
    {"attempt": 0, "completed_at": null, "input_sha256": null, "name": "retrieve", "output_sha256": null, "started_at": null, "status": "pending"},
    {"attempt": 0, "completed_at": null, "input_sha256": null, "name": "plan-import", "output_sha256": null, "started_at": null, "status": "pending"},
    {"attempt": 0, "completed_at": null, "input_sha256": null, "name": "generation-request", "output_sha256": null, "started_at": null, "status": "pending"},
    {"attempt": 0, "completed_at": null, "input_sha256": null, "name": "candidate", "output_sha256": null, "started_at": null, "status": "pending"},
    {"attempt": 0, "completed_at": null, "input_sha256": null, "name": "bundle-assemble", "output_sha256": null, "started_at": null, "status": "pending"},
    {"attempt": 0, "completed_at": null, "input_sha256": null, "name": "validation", "output_sha256": null, "started_at": null, "status": "pending"},
    {"attempt": 0, "completed_at": null, "input_sha256": null, "name": "evaluation", "output_sha256": null, "started_at": null, "status": "pending"}
  ],
  "status": "created",
  "target": {"base_sha": "aaaaaaaaaaaaaaaaaaaaaaaaaaaaaaaaaaaaaaaa", "repository": "acfufu/readme-showcase", "root": "/tmp/readme-showcase-target"},
  "updated_at": "2026-08-02T00:00:00Z"
}
